Work Item Type,Title 1,Title 2,Title 3,Description,Area Path,Iteration Path,Priority,Effort,Tags
Epic,API Modernization Reference Architecture,,,"Deliver a code-based reference architecture for Client Solutions' Insurance Quoting Platform (iQQ) demonstrating modern API-driven application patterns with AWS services, microservices architecture, and infrastructure as code.",cstg-internal-cloud-architecture,cstg-internal-cloud-architecture\Sprint 1,2,,api-modernization;reference-architecture;aws
Issue,,Infrastructure Setup,,"Setup foundational infrastructure using Terraform with remote state management in S3 and DynamoDB state locking. Provision API Gateway with REST API configuration including multiple stages (dev/test/prod), CORS policies for cross-origin requests, request/response validation, and CloudWatch logging with custom log formats. Configure VPC endpoints if needed for private API access. Implement resource tagging strategy and cost allocation tags. Deliverables: Terraform modules for API Gateway, S3 backend configuration, DynamoDB table for state locking, CloudWatch log groups with retention policies, and IAM roles with least privilege access.",cstg-internal-cloud-architecture,cstg-internal-cloud-architecture\Sprint 1,1,13,terraform;iac;api-gateway;automation-kiro
Issue,,API Versioning and Routing,,"Implement comprehensive Lambda versioning strategy with semantic versioning (v1, v2, latest) using Lambda aliases and version pinning. Configure API Gateway stage variables to dynamically route requests to appropriate Lambda versions based on client requirements. Setup canary deployments for gradual rollout of new versions. Document version deprecation policy and backward compatibility requirements. Create version-specific CloudWatch dashboards for monitoring. Deliverables: Lambda version management scripts, API Gateway stage variable configuration, version routing documentation with examples, rollback procedures, and automated version deployment pipeline.",cstg-internal-cloud-architecture,cstg-internal-cloud-architecture\Sprint 1,2,18,versioning;lambda;api-gateway;terraform;automation-kiro
Issue,,Authentication and Authorization,,"Setup AWS Cognito User Pool with OAuth 2.0 client credentials flow for machine-to-machine authentication. Configure user pool with password policies, MFA options, and custom attributes. Implement custom Lambda authorizer for JWT token validation including signature verification, expiration checks, and claims validation. Configure API Gateway to use the authorizer with caching for performance. Setup token refresh mechanism and revocation handling. Implement fine-grained authorization with scopes and permissions. Deliverables: Cognito User Pool configuration, Lambda authorizer code with comprehensive validation logic, API Gateway authorizer integration, token management utilities, security testing suite, and authentication flow documentation.",cstg-internal-cloud-architecture,cstg-internal-cloud-architecture\Sprint 1,1,10,cognito;authentication;oauth;lambda-authorizer;automation-kiro
Issue,,Lender Microservice,,"Create dedicated repository with TypeScript Lambda implementation following domain-driven design principles. Implement domain models for Lender entity with validation rules and business logic. Setup AWS SAM configuration with local development environment using SAM CLI. Integrate with API Gateway using proxy integration pattern. Implement CRUD operations with input validation and error handling. Write comprehensive unit tests using Jest achieving minimum 80% code coverage including edge cases and error scenarios. Setup ESLint and Prettier for code quality. Implement structured logging with correlation IDs. Deliverables: GitHub repository with CI/CD configuration, TypeScript Lambda code with domain models, SAM template with resource definitions, Jest test suite with coverage reports, API documentation, and local development setup guide.",cstg-internal-cloud-architecture,cstg-internal-cloud-architecture\Sprint 1,1,21,lambda;microservice;lender;sam;jest;automation-kiro
Issue,,Package Microservice,,"Create dedicated repository with TypeScript Lambda implementation following domain-driven design principles. Implement domain models for Package entity with validation rules and business logic. Setup AWS SAM configuration with local development environment using SAM CLI. Integrate with API Gateway using proxy integration pattern. Implement CRUD operations with input validation and error handling. Write comprehensive unit tests using Jest achieving minimum 80% code coverage including edge cases and error scenarios. Setup ESLint and Prettier for code quality. Implement structured logging with correlation IDs. Deliverables: GitHub repository with CI/CD configuration, TypeScript Lambda code with domain models, SAM template with resource definitions, Jest test suite with coverage reports, API documentation, and local development setup guide.",cstg-internal-cloud-architecture,cstg-internal-cloud-architecture\Sprint 1,1,21,lambda;microservice;package;sam;jest;automation-kiro
Issue,,Product Microservice,,"Create dedicated repository with TypeScript Lambda implementation following domain-driven design principles. Implement domain models for Product entity with validation rules and business logic. Setup AWS SAM configuration with local development environment using SAM CLI. Integrate with API Gateway using proxy integration pattern. Implement CRUD operations with input validation and error handling. Write comprehensive unit tests using Jest achieving minimum 80% code coverage including edge cases and error scenarios. Setup ESLint and Prettier for code quality. Implement structured logging with correlation IDs. Deliverables: GitHub repository with CI/CD configuration, TypeScript Lambda code with domain models, SAM template with resource definitions, Jest test suite with coverage reports, API documentation, and local development setup guide.",cstg-internal-cloud-architecture,cstg-internal-cloud-architecture\Sprint 1,1,21,lambda;microservice;product;sam;jest;automation-kiro
Issue,,Document Microservice,,"Create dedicated repository with TypeScript Lambda implementation following domain-driven design principles. Implement domain models for Document entity with validation rules and business logic. Setup AWS SAM configuration with local development environment using SAM CLI. Integrate with API Gateway using proxy integration pattern. Implement CRUD operations with input validation and error handling. Write comprehensive unit tests using Jest achieving minimum 80% code coverage including edge cases and error scenarios. Setup ESLint and Prettier for code quality. Implement structured logging with correlation IDs. Deliverables: GitHub repository with CI/CD configuration, TypeScript Lambda code with domain models, SAM template with resource definitions, Jest test suite with coverage reports, API documentation, and local development setup guide.",cstg-internal-cloud-architecture,cstg-internal-cloud-architecture\Sprint 1,1,21,lambda;microservice;document;sam;jest;automation-kiro
Issue,,API Testing Framework,,"Setup comprehensive API testing framework using Postman and SoapUI with organized collections for all microservices. Implement OAuth 2.0 authentication flows in test collections with token management and refresh logic. Create test scripts covering happy path scenarios, error conditions, edge cases, validation failures, and security tests. Implement data-driven testing with CSV/JSON data files. Setup environment variables for different deployment stages. Integrate Newman CLI for automated test execution in CI/CD pipelines with JUnit XML reporting. Configure test result publishing and failure notifications. Deliverables: Postman collections with pre-request scripts and tests, SoapUI project files, Newman configuration, CI/CD integration scripts, test data files, and testing documentation with examples.",cstg-internal-cloud-architecture,cstg-internal-cloud-architecture\Sprint 1,2,13,api-testing;postman;soapui;newman;automation-kiro
Issue,,Observability and Monitoring,,"Implement comprehensive observability solution with correlation ID propagation across all Lambda functions and API Gateway requests. Setup structured JSON logging with consistent log format including timestamp, level, correlation ID, service name, and contextual metadata. Enable AWS X-Ray tracing for distributed tracing across API Gateway, Lambda, and downstream services with custom segments and annotations. Create CloudWatch dashboards with key metrics including request count, latency percentiles (p50, p95, p99), error rates, throttles, and concurrent executions. Configure CloudWatch alarms for critical metrics with SNS notifications. Setup log insights queries for common troubleshooting scenarios. Implement custom metrics for business KPIs. Deliverables: Logging utility library, X-Ray instrumentation code, CloudWatch dashboard JSON templates, alarm configurations, log insights queries, runbook for common issues, and observability best practices documentation.",cstg-internal-cloud-architecture,cstg-internal-cloud-architecture\Sprint 1,2,16,cloudwatch;xray;monitoring;logging;automation-kiro
Issue,,Integration and Contract Testing,,"Create comprehensive integration test suite covering end-to-end flows from API Gateway through Lambda functions with Cognito authentication. Test request/response transformations, error handling, timeout scenarios, and retry logic. Implement contract testing using Pact or similar framework to validate API schemas and ensure backward compatibility between service versions. Test API Gateway features including request validation, response mapping, and authorizer integration. Create test fixtures and mock data for consistent testing. Setup automated test execution in CI/CD pipeline with test result reporting. Deliverables: Integration test suite with Jest/Mocha, contract test definitions, test data fixtures, CI/CD integration, test coverage reports, and integration testing documentation.",cstg-internal-cloud-architecture,cstg-internal-cloud-architecture\Sprint 1,2,13,integration-tests;contract-tests;api-schema;automation-kiro
Issue,,Documentation and Architecture Review,,"Create comprehensive technical documentation including Architecture Decision Records (ADRs) for key design choices with context, decision, and consequences. Generate OpenAPI 3.0/Swagger specifications for all API endpoints with detailed request/response schemas, authentication requirements, and example payloads. Write deployment guides covering prerequisites, step-by-step deployment instructions, configuration management, and troubleshooting. Document observability patterns including logging standards, tracing setup, and monitoring dashboards. Create architecture diagrams using C4 model or similar showing system context, containers, and components. Prepare architecture review presentation with design rationale, trade-offs, and future considerations. Deliverables: ADR documents, OpenAPI specifications, deployment runbooks, observability playbook, architecture diagrams, review presentation deck, and developer onboarding guide.",cstg-internal-cloud-architecture,cstg-internal-cloud-architecture\Sprint 1,2,16,documentation;adr;openapi;deployment-guide;automation-manual
Issue,,CI/CD Pipeline Setup,,"Setup automated CI/CD pipelines using GitHub Actions or Azure DevOps for all microservices with multi-stage workflow. Implement build stage with dependency installation, TypeScript compilation, linting with ESLint, and security scanning. Create test stage running unit tests with Jest, integration tests, and contract tests with coverage reporting and quality gates (minimum 80% coverage). Implement SAM build and package stages with artifact management. Setup deployment stages for dev, test, and prod environments with approval gates for production. Configure automated rollback on deployment failures. Implement secrets management using AWS Secrets Manager or Parameter Store. Setup deployment notifications and status badges. Deliverables: GitHub Actions workflows or Azure Pipelines YAML, deployment scripts, environment configuration files, secrets management setup, pipeline documentation, and troubleshooting guide.",cstg-internal-cloud-architecture,cstg-internal-cloud-architecture\Sprint 1,2,20,cicd;github-actions;azure-devops;automation;automation-kiro
Epic,Package Microservice Implementation,,,"Implement fully functional package microservice with GET quote and POST accept endpoints, Step Functions orchestration for multi-provider quote aggregation, and DynamoDB-based configuration management for clients, products, and providers.",cstg-internal-cloud-architecture,cstg-internal-cloud-architecture\Sprint 1,2,,package;step-functions;dynamodb;orchestration
Issue,,Package Quote and Accept Endpoints,,"Implement RESTful API endpoints in API Gateway: GET /package/quote for retrieving insurance package quotes with query parameters for client ID, product type, and coverage details; POST /package/accept for accepting quotes with request body containing quote ID and customer information. Configure API Gateway to trigger Step Functions state machine execution using service integration. Implement request validation schemas to ensure data quality. Setup response mapping templates for consistent API responses. Configure timeout and throttling limits. Implement idempotency for accept endpoint using idempotency tokens. Add CORS configuration for web client access. Deliverables: API Gateway resource and method configurations, request/response models, integration with Step Functions, validation schemas, error response templates, and API endpoint documentation with curl examples.",cstg-internal-cloud-architecture,cstg-internal-cloud-architecture\Sprint 1,1,13,package;api-gateway;step-functions;automation-kiro
Issue,,Step Functions Orchestration,,"Design and implement AWS Step Functions state machine for orchestrating multi-provider quote aggregation workflow. Implement parallel state for concurrent provider invocations with configurable timeout (30 seconds default). Add fallback logic using Catch and Retry with exponential backoff for transient failures. Implement Map state for dynamic provider list processing. Create Choice states for conditional routing based on provider responses. Implement response aggregation Lambda to merge and rank quotes from multiple providers. Add data transformation tasks to normalize provider responses into standard format. Implement comprehensive error handling with dead letter queue for failed executions. Add CloudWatch Events rules for monitoring execution status. Configure Step Functions logging to CloudWatch. Deliverables: Step Functions state machine definition (ASL JSON), aggregation Lambda function, error handling configuration, CloudWatch integration, state machine visualization, execution flow documentation, and performance tuning guide.",cstg-internal-cloud-architecture,cstg-internal-cloud-architecture\Sprint 1,1,21,step-functions;orchestration;providers;terraform;automation-kiro
Issue,,Provider Integration Layer,,"Create Lambda functions for integrating with external insurance provider web services supporting multiple protocols (REST, SOAP, HTTP). Implement request builders for each provider with provider-specific authentication (API keys, OAuth, basic auth). Parse diverse response formats including CSV (comma/pipe delimited), JSON (nested/flat structures), and XML (various schemas) with robust error handling. Implement product-specific mapping transformations using configuration-driven approach to prevent domain model leakage between providers. Add response validation and data quality checks. Implement circuit breaker pattern for provider failures. Add request/response logging for audit trail. Configure timeout and retry policies per provider. Implement rate limiting to respect provider API limits. Deliverables: Provider integration Lambda functions, response parser utilities, mapping transformation engine, circuit breaker implementation, provider adapter interfaces, integration test suite with mock providers, and provider integration documentation.",cstg-internal-cloud-architecture,cstg-internal-cloud-architecture\Sprint 1,1,16,lambda;providers;csv;json;xml;mapping;automation-kiro
Issue,,DynamoDB Configuration Management,,"Design single-table DynamoDB schema following best practices with composite primary keys (PK/SK pattern) for clients, products, and providers entities. Implement Global Secondary Indexes (GSIs) for common query patterns including lookup by client name, product type, and provider status. Provision DynamoDB table using Terraform with on-demand or provisioned capacity based on workload analysis. Configure point-in-time recovery and encryption at rest. Implement CRUD Lambda functions with DynamoDB DocumentClient for create, read, update, and delete operations with optimistic locking using version attributes. Add batch operations for bulk data management. Implement query and scan operations with pagination. Create data seeding scripts to populate initial product catalog, client configurations, and provider details. Add data validation and referential integrity checks. Deliverables: DynamoDB table schema documentation, Terraform configuration, CRUD Lambda functions, data seeding scripts, query examples, access patterns documentation, and capacity planning guide.",cstg-internal-cloud-architecture,cstg-internal-cloud-architecture\Sprint 1,1,16,dynamodb;single-table;terraform;crud;automation-kiro
Issue,,Provider Mapping Configuration,,"Extend DynamoDB schema to store provider mapping configurations with composite keys for product-provider combinations. Design mapping configuration structure supporting field name transformations (source to target field mapping), data type conversions (string to number, date format changes), value transformations (unit conversions, enumeration mapping), conditional logic (if-then rules), and default values. Create realistic mapping configurations for each product-provider pair demonstrating complex transformations including nested object mapping, array transformations, and calculated fields. Implement mapping retrieval Lambda function with caching for performance. Create mapping application engine that applies transformations to provider responses. Add mapping validation to ensure all required fields are mapped and transformations are valid. Implement versioning for mapping configurations to support updates without breaking existing integrations. Deliverables: Extended DynamoDB schema, mapping configuration JSON examples, mapping retrieval and application Lambda functions, transformation engine, validation rules, mapping version management, and mapping configuration guide with examples.",cstg-internal-cloud-architecture,cstg-internal-cloud-architecture\Sprint 1,2,23,dynamodb;mapping;transformation;validation;automation-kiro
Issue,,Mock Provider Responses,,"Develop comprehensive set of realistic mock provider responses demonstrating diverse data formats and schemas. Create CSV responses with different delimiters (comma, pipe, tab), header variations (with/without headers), and data types (quoted strings, numbers, dates). Create JSON responses with varied structures including nested objects, arrays, flat structures, and mixed nesting levels. Create XML responses with different schemas, namespaces, attributes vs elements, and CDATA sections. Ensure mock data includes diverse field names (camelCase, snake_case, PascalCase), different data representations (dates as strings/timestamps, booleans as true/false/1/0), and various data types (strings, numbers, decimals, dates). Include edge cases like missing fields, null values, empty arrays, and special characters. Organize mock files by provider and product type. Deliverables: Mock CSV files (5+ providers), mock JSON files (5+ providers), mock XML files (5+ providers), mock data generation scripts, and mock data documentation explaining schema variations.",cstg-internal-cloud-architecture,cstg-internal-cloud-architecture\Sprint 1,2,8,mock-data;providers;csv;json;xml;automation-kiro
Issue,,Package Service Observability,,"Enable comprehensive observability for package service components. Configure AWS X-Ray tracing for package Lambda functions and Step Functions state machine with custom segments for provider calls and subsegments for transformation operations. Add X-Ray annotations for filtering (product type, provider name, quote amount) and metadata for debugging. Create CloudWatch dashboards with package-specific metrics including quote request volume, quote acceptance rate, provider response times (per provider), Step Functions execution duration, success/failure rates, and cost per quote. Implement custom CloudWatch metrics for business KPIs like average quote amount and provider selection distribution. Configure CloudWatch alarms for critical conditions including Step Functions execution failures, provider timeout rate exceeding threshold, quote processing latency above SLA, and DynamoDB throttling. Setup SNS topics for alarm notifications with email and Slack integration. Create CloudWatch Insights queries for common troubleshooting scenarios. Deliverables: X-Ray instrumentation code, CloudWatch dashboard JSON, custom metrics implementation, alarm configurations with runbooks, CloudWatch Insights queries, and observability documentation.",cstg-internal-cloud-architecture,cstg-internal-cloud-architecture\Sprint 1,2,13,xray;cloudwatch;monitoring;step-functions;automation-kiro
Issue,,Package Service Testing,,"Write comprehensive test suite for package service. Create unit tests for package Lambda functions covering request validation, business logic, error handling, and edge cases using Jest with mocking for AWS SDK calls. Achieve minimum 80% code coverage with focus on critical paths. Create integration tests for Step Functions workflow using AWS SDK to start executions and verify state transitions, parallel provider invocations, error handling, and retry logic. Test timeout scenarios and fallback behavior. Mock provider responses for consistent testing. Develop Postman collection for quote and accept endpoints with test scripts validating response schemas, status codes, error messages, and business rules. Include tests for authentication, authorization, and rate limiting. Create DynamoDB integration tests for CRUD operations, query patterns, and data consistency. Implement load tests using Artillery or similar tool to validate performance under load. Setup automated test execution in CI/CD pipeline. Deliverables: Jest unit test suite with coverage reports, Step Functions integration tests, Postman collection with test scripts, DynamoDB test suite, load test scripts, test data fixtures, and testing documentation.",cstg-internal-cloud-architecture,cstg-internal-cloud-architecture\Sprint 1,2,21,unit-tests;integration-tests;postman;jest;automation-kiro
Issue,,Package Service Documentation,,"Create comprehensive documentation for package service. Document Step Functions workflow with state machine diagram showing all states, transitions, error handling paths, and retry logic. Include execution flow examples for success and failure scenarios. Document DynamoDB schema with entity relationship diagram, access patterns, query examples, and capacity planning considerations. Create configuration management guide covering how to add new clients, products, providers, and mapping configurations with step-by-step instructions and examples. Generate OpenAPI 3.0 specification for quote and accept endpoints with detailed schemas, authentication requirements, example requests/responses, and error codes. Document provider integration patterns including authentication methods, request formats, response parsing, and error handling. Create mapping configuration format documentation with JSON schema, transformation syntax, examples for common scenarios, and validation rules. Include troubleshooting guide with common issues and solutions. Deliverables: Step Functions workflow documentation with diagrams, DynamoDB schema guide, configuration management procedures, OpenAPI specification, provider integration guide, mapping format specification, troubleshooting guide, and architecture overview.",cstg-internal-cloud-architecture,cstg-internal-cloud-architecture\Sprint 1,2,16,documentation;step-functions;dynamodb;openapi;automation-manual
